{
  "schema_version": "1.1.0",
  "family": "bass",
  "description": "Electric-bass anchors spanning register and velocity; D2 is held out.",
  "cases": [
    {
      "id": "e1-mf",
      "role": "tune",
      "reference": "references/bass/canonical/E1-mf.wav",
      "render": { "family": "bass", "midi": 28, "velocity": 88, "note_seconds": 4.0, "total_seconds": 7.0, "sample_rate": 48000, "lead_seconds": 0.03 },
      "analysis": { "profile": "pitched", "required_axes": ["mr_stft", "attack", "decay", "partials"], "partial_model": { "type": "proximity_harmonic", "search_cents": 90.0 } }
    },
    {
      "id": "a1-pp",
      "role": "tune",
      "reference": "references/bass/canonical/A1-pp.wav",
      "render": { "family": "bass", "midi": 33, "velocity": 38, "note_seconds": 4.0, "total_seconds": 7.0, "sample_rate": 48000, "lead_seconds": 0.03 },
      "analysis": { "profile": "pitched", "required_axes": ["mr_stft", "attack", "decay", "partials"], "partial_model": { "type": "proximity_harmonic", "search_cents": 90.0 } }
    },
    {
      "id": "a1-ff",
      "role": "tune",
      "reference": "references/bass/canonical/A1-ff.wav",
      "render": { "family": "bass", "midi": 33, "velocity": 122, "note_seconds": 4.0, "total_seconds": 7.0, "sample_rate": 48000, "lead_seconds": 0.03 },
      "analysis": { "profile": "pitched", "required_axes": ["mr_stft", "attack", "decay", "partials"], "partial_model": { "type": "proximity_harmonic", "search_cents": 90.0 } }
    },
    {
      "id": "d2-mf",
      "role": "held_out",
      "reference": "references/bass/canonical/D2-mf.wav",
      "render": { "family": "bass", "midi": 38, "velocity": 88, "note_seconds": 3.5, "total_seconds": 6.5, "sample_rate": 48000, "lead_seconds": 0.03 },
      "analysis": { "profile": "pitched", "required_axes": ["mr_stft", "attack", "decay", "partials"], "partial_model": { "type": "proximity_harmonic", "search_cents": 90.0 } }
    }
  ]
}
