{
  "schema_version": "1.1.0",
  "family": "drums",
  "description": "Pop/rock/jazz kit anchors; jazz brush is held out from kick/snare fitting.",
  "cases": [
    {
      "id": "pop-kick-ff",
      "role": "tune",
      "reference": "references/drumkit/canonical/pop-kick-ff.wav",
      "render": { "family": "drums", "midi": 36, "velocity": 120, "note_seconds": 0.3, "total_seconds": 4.0, "sample_rate": 48000, "lead_seconds": 0.03 },
      "analysis": { "profile": "kick", "required_axes": ["mr_stft", "attack", "decay", "lufs"] }
    },
    {
      "id": "rock-kick-mf",
      "role": "tune",
      "reference": "references/drumkit/canonical/rock-kick-mf.wav",
      "render": { "family": "drums-rock", "midi": 36, "velocity": 75, "note_seconds": 0.3, "total_seconds": 4.0, "sample_rate": 48000, "lead_seconds": 0.03 },
      "analysis": { "profile": "kick", "required_axes": ["mr_stft", "attack", "decay", "lufs"] }
    },
    {
      "id": "rock-snare-ff",
      "role": "tune",
      "reference": "references/drumkit/canonical/rock-snare-ff.wav",
      "render": { "family": "drums-rock", "midi": 38, "velocity": 120, "note_seconds": 0.3, "total_seconds": 4.0, "sample_rate": 48000, "lead_seconds": 0.03 },
      "analysis": { "profile": "default", "required_axes": ["mr_stft", "attack", "decay", "lufs"] }
    },
    {
      "id": "jazz-brush-mf",
      "role": "held_out",
      "reference": "references/drumkit/canonical/jazz-brush-mf.wav",
      "render": { "family": "drums-jazz", "midi": 38, "velocity": 75, "note_seconds": 0.3, "total_seconds": 4.0, "sample_rate": 48000, "lead_seconds": 0.03 },
      "analysis": { "profile": "default", "required_axes": ["mr_stft", "attack", "decay", "lufs"] }
    }
  ]
}
